,tweet_id,created_datetime,content,author_id,place_id,location,longitude,latitude,county,label,sentiment_1,sentiment_2
548,1.8976849009639424e+17,2012-04-10,Black bear contained in La Crescenta backyard http://t.co/tq4rxCoc via http://t.co/ipBHOOw5,17271011.0,509a2c2b2f6206fa,Glendale,-118.21873,34.166492,LOS ANGELES,2.0,neutral,neutral
549,1.8976849329246208e+17,2012-04-10,Black bear down for the count after tranquilizer shots http://t.co/ctTwpKCD via http://t.co/8Y02GbfM,17304703.0,e6fc035b8939bd3b,"Arcadia, CA",-118.03244,34.134384,LOS ANGELES,2.0,neutral,negative
550,1.8976851053944006e+17,2012-04-10,Black bear contained in La Crescenta backyard http://t.co/0mE4yprf via http://t.co/X77uTn9s,16705640.0,c2ad98c80a97adde,"El Monte, CA",-118.014046,34.070866,LOS ANGELES,2.0,neutral,neutral
551,1.8976851216683418e+17,2012-04-10,Black bear contained in La Crescenta backyard http://t.co/RhIsG26C via http://t.co/XGwgbMsf,16948273.0,122aef8d6840943b,"South El Monte, CA",-118.05202,34.044796,LOS ANGELES,2.0,neutral,neutral
552,1.897978984127529e+17,2012-04-10,Black bear contained in La Crescenta backyard http://t.co/lWJnvUBq via http://t.co/ymtZL2bx,17231565.0,fbd6d2f5a4e4a15e,"California, USA",-118.026115,34.00327,LOS ANGELES,2.0,neutral,neutral
553,1.89797920885846e+17,2012-04-10,Black bear down for the count after tranquilizer shots http://t.co/ObeNCHRF via http://t.co/DZCHUvtY,17280372.0,e6fc035b8939bd3b,"Arcadia, CA",-118.04954,34.125076,LOS ANGELES,2.0,neutral,negative
554,1.897979291821712e+17,2012-04-10,Update: Officials Tranquilize Meatball-Seeking Bear in Montrose (Video) http://t.co/EBjzfKRU via http://t.co/ke4K6NfI,17285261.0,509a2c2b2f6206fa,Glendale,-118.24954,34.193275,LOS ANGELES,2.0,neutral,neutral
555,1.8979793107381043e+17,2012-04-10,Montrose-La Crescenta Bear to be Relocated (Video) http://t.co/cMmL2uHf via http://t.co/G6hnwlHA,17423437.0,33ea9c2aad1edb4c,"La Crescenta-Montrose, CA",-118.24551,34.231247,LOS ANGELES,2.0,neutral,neutral
556,1.897979334855312e+17,2012-04-10,Residents cheer as 'Glendale bear' safely taken away http://t.co/TcYipeH7 via http://t.co/8Y02GbfM,17304703.0,e6fc035b8939bd3b,"Arcadia, CA",-118.03244,34.134384,LOS ANGELES,2.0,joy,positive
557,1.8979793568754483e+17,2012-04-10,Residents cheer as 'Glendale bear' safely taken away http://t.co/dOV7xzOE via http://t.co/DZCHUvtY,17280372.0,e6fc035b8939bd3b,"Arcadia, CA",-118.04954,34.125076,LOS ANGELES,2.0,joy,positive
558,1.897979374239744e+17,2012-04-10,Update: Officials Tranquilize Meatball-Seeking Bear in Montrose (Video) http://t.co/Uq65cPJI via http://t.co/G6hnwlHA,17423437.0,33ea9c2aad1edb4c,"La Crescenta-Montrose, CA",-118.24551,34.231247,LOS ANGELES,2.0,neutral,neutral
559,1.8979793766305792e+17,2012-04-10,Montrose-La Crescenta Bear to be Relocated (Video) http://t.co/v95mD2Wx via http://t.co/ke4K6NfI,17285261.0,509a2c2b2f6206fa,Glendale,-118.24954,34.193275,LOS ANGELES,2.0,neutral,neutral
560,1.89797954498986e+17,2012-04-10,Montrose-La Crescenta Bear to be Relocated (Video) http://t.co/xQ72c2RP via http://t.co/bEbCP1L8,16945858.0,3b77caf94bfc81fe,"Los Angeles, CA",-118.344505,34.231613,LOS ANGELES,2.0,neutral,neutral
561,1.8979798131317146e+17,2012-04-10,Black bear contained in La Crescenta backyard http://t.co/drrUUBI6 via http://t.co/KSqwBPg9,17280768.0,9f151172bfd5aa1d,"Avocado Heights, CA",-117.99532,34.04327,LOS ANGELES,2.0,neutral,neutral
562,1.8981465125146624e+17,2012-04-10,Officials Tranquilize Meatball-Seeking Bear in Montrose - http://t.co/oubjvOzF #Montrose #California,87321283.0,33ea9c2aad1edb4c,"La Crescenta-Montrose, CA",-118.23194,34.212524,LOS ANGELES,2.0,neutral,neutral
563,1.8982557166300365e+17,2012-04-10,Update: Officials Tranquilize Meatball-Seeking Bear (Video) http://t.co/K4cWwfJ7 via http://t.co/DZCHUvtY,17280372.0,e6fc035b8939bd3b,"Arcadia, CA",-118.04954,34.125076,LOS ANGELES,2.0,neutral,neutral
564,1.898255763102761e+17,2012-04-10,Update: Officials Tranquilize Meatball-Seeking Bear (Video) http://t.co/0NA5b4QS via http://t.co/8Y02GbfM,17304703.0,e6fc035b8939bd3b,"Arcadia, CA",-118.03244,34.134384,LOS ANGELES,2.0,neutral,neutral
565,1.8982558659472176e+17,2012-04-10,Update: Officials Tranquilize Meatball-Seeking Bear (Video) http://t.co/NrAU8fYl via http://t.co/otwhqIIc,16806547.0,92ae8eec9b1cca5d,"Bradbury, CA",-117.97408,34.153507,LOS ANGELES,2.0,neutral,neutral
566,1.8982559526014566e+17,2012-04-10,Black bear caught in Montrose neighborhood http://t.co/NuTxgaj8 via http://t.co/Bt7MKv6k,17151483.0,ee6eb0b2e3b14f8a,"South Antelope Valley, CA",-118.2352,34.280083,LOS ANGELES,2.0,neutral,neutral
567,1.8982772053916058e+17,2012-04-10,Update: Officials Tranquilize Meatball-Seeking Bear in Montrose (Video) http://t.co/NO5rABJo via http://t.co/bEbCP1L8,16945858.0,3b77caf94bfc81fe,"Los Angeles, CA",-118.344505,34.231613,LOS ANGELES,2.0,neutral,neutral
568,1.8982773162050355e+17,2012-04-10,Update: Officials Tranquilize Meatball-Seeking Bear (Video) http://t.co/fy9xfUbX via http://t.co/sdX5op3H,17209250.0,10de09f288b1665c,"Pasadena, CA",-118.08942,34.16201,LOS ANGELES,2.0,neutral,neutral
569,1.8985864488668365e+17,2012-04-10,"New Photo: Sedated, Tagged Meatball Bear http://t.co/bfWCIl8P via http://t.co/sdX5op3H",17209250.0,10de09f288b1665c,"Pasadena, CA",-118.08942,34.16201,LOS ANGELES,2.0,neutral,neutral
570,1.898818814105518e+17,2012-04-11,Huge black bear on the move in La Crescenta - http://t.co/1i0Vmth3 #LaCrescenta #California,87321283.0,33ea9c2aad1edb4c,"La Crescenta-Montrose, CA",-118.23076,34.212234,LOS ANGELES,2.0,fear,neutral
571,1.8990591470535475e+17,2012-04-11,Glendale bear relocated to Angeles National Forest -Glendale News Press http://t.co/VBYPh0dn #NorthGlendale #CA,347508855.0,3b77caf94bfc81fe,"Los Angeles, CA",-118.29866,33.786594,LOS ANGELES,2.0,neutral,neutral
572,1.8995688988542566e+17,2012-04-11,Bear Captured in Montrose http://t.co/rzLjxxCK,17155355.0,b0b79caecef59fb5,"Burbank, CA",-118.326584,34.203148,LOS ANGELES,2.0,neutral,neutral
573,1.8995690122262528e+17,2012-04-11,Glendale bear returned to forest with 'heck of a hangover' http://t.co/TXZQhA0K,17155355.0,b0b79caecef59fb5,"Burbank, CA",-118.326584,34.203148,LOS ANGELES,2.0,neutral,neutral
574,1.899612794007101e+17,2012-04-11,"With help of tranquilizer darts, black bear sent back to forest http://t.co/OG4ge1bo via http://t.co/8Y02GbfM",17304703.0,e6fc035b8939bd3b,"Arcadia, CA",-118.03244,34.134384,LOS ANGELES,2.0,neutral,neutral
575,1.8996128188373808e+17,2012-04-11,"With help of tranquilizer darts, black bear sent back to forest http://t.co/9MD3Po4m via http://t.co/Bt7MKv6k",17151483.0,ee6eb0b2e3b14f8a,"South Antelope Valley, CA",-118.2352,34.280083,LOS ANGELES,2.0,neutral,neutral
576,1.8996129112378982e+17,2012-04-11,"With help of tranquilizer darts, black bear sent back to forest http://t.co/pz7LjSjl via http://t.co/DZCHUvtY",17280372.0,e6fc035b8939bd3b,"Arcadia, CA",-118.04954,34.125076,LOS ANGELES,2.0,neutral,neutral
580,1.8996132780299056e+17,2012-04-11,Bear Captured in Montrose http://t.co/0187uv0f,17151835.0,b0b79caecef59fb5,"Burbank, CA",-118.3044,34.19948,LOS ANGELES,2.0,neutral,neutral
581,1.900396492914811e+17,2012-04-11,Glendale bear returned to forest with 'heck of a hangover' http://t.co/sMWmorr5 via http://t.co/DZCHUvtY,17280372.0,e6fc035b8939bd3b,"Arcadia, CA",-118.04954,34.125076,LOS ANGELES,2.0,neutral,neutral
582,1.9013080165083136e+17,2012-04-11,Bear Released in Angeles National Forest (Photos) http://t.co/IDn1ljo8 via http://t.co/Bt7MKv6k,17151483.0,ee6eb0b2e3b14f8a,"South Antelope Valley, CA",-118.2352,34.280083,LOS ANGELES,2.0,neutral,neutral
583,1.901308194976072e+17,2012-04-11,Bear Released in Angeles National Forest (Photos) http://t.co/6HFa02aJ via http://t.co/ke4K6NfI,17285261.0,509a2c2b2f6206fa,Glendale,-118.24954,34.193275,LOS ANGELES,2.0,neutral,neutral
584,1.9013082449721344e+17,2012-04-11,Bear Released in Angeles National Forest (Photos) http://t.co/Ae8Q2noB via http://t.co/G6hnwlHA,17423437.0,33ea9c2aad1edb4c,"La Crescenta-Montrose, CA",-118.24551,34.231247,LOS ANGELES,2.0,neutral,neutral
585,1.9014572091179008e+17,2012-04-11,@arte_su there's ANOTHER Gloomy Bear?! WHAAAAA? :O,137705926.0,3b77caf94bfc81fe,"Los Angeles, CA",-118.36518,33.99941,LOS ANGELES,2.0,surprise,neutral
586,1.9016051834919728e+17,2012-04-11,Bear Released in Angeles National Forest (Photos) http://t.co/rGf3IxNc via http://t.co/otwhqIIc,16806547.0,92ae8eec9b1cca5d,"Bradbury, CA",-117.97408,34.153507,LOS ANGELES,2.0,neutral,neutral
587,1.901605186134344e+17,2012-04-11,Glendale bear ear-tagged before release into forest http://t.co/Bvg5FtaX via http://t.co/DZCHUvtY,17280372.0,e6fc035b8939bd3b,"Arcadia, CA",-118.04954,34.125076,LOS ANGELES,2.0,neutral,neutral
588,1.9016052048829235e+17,2012-04-11,Bear Released in Angeles National Forest (Photos) http://t.co/VxQujAf3 via http://t.co/8Y02GbfM,17304703.0,e6fc035b8939bd3b,"Arcadia, CA",-118.03244,34.134384,LOS ANGELES,2.0,neutral,neutral
589,1.9016053037006848e+17,2012-04-11,Bear Released in Angeles National Forest (Photos) http://t.co/2c3Qd8G1 via http://t.co/sdX5op3H,17209250.0,10de09f288b1665c,"Pasadena, CA",-118.08942,34.16201,LOS ANGELES,2.0,neutral,neutral
590,1.9016054075937178e+17,2012-04-11,Glendale bear ear-tagged before release into forest http://t.co/9IcYi8x1 via http://t.co/Bt7MKv6k,17151483.0,ee6eb0b2e3b14f8a,"South Antelope Valley, CA",-118.2352,34.280083,LOS ANGELES,2.0,neutral,neutral
591,1.9016483059702576e+17,2012-04-11,"Don't text and walk. You might get eaten by a bear...
http://t.co/GUPv0aD7",198556115.0,50ba6eff7160157b,"San Buenaventura (Ventura), CA",-119.228294,34.278957,VENTURA,2.0,fear,negative
592,1.9018822219268096e+17,2012-04-11,Bear Released in Angeles National Forest (Photos) http://t.co/NOQxuFfS via http://t.co/bEbCP1L8,16945858.0,3b77caf94bfc81fe,"Los Angeles, CA",-118.344505,34.231613,LOS ANGELES,2.0,neutral,neutral
593,1.9032391074147123e+17,2012-04-12,Bear Released in Angeles National Forest (Photos) http://t.co/LSo0oKLW via http://t.co/DZCHUvtY,17280372.0,e6fc035b8939bd3b,"Arcadia, CA",-118.04954,34.125076,LOS ANGELES,2.0,neutral,neutral
594,1.9032645696920368e+17,2012-04-12,UPDATE 9:30 a.m.: BEAR http://t.co/hD8ERV5z,17151835.0,b0b79caecef59fb5,"Burbank, CA",-118.3044,34.19948,LOS ANGELES,2.0,neutral,neutral
595,19047953396.0,2010-07-21,Also significant: one of my roommate's jobs is to chase bears.  That's a job.  For which you can apply.  Bear Chaser.,18914539.0,cad414d9f9d60838,"Yosemite Valley, CA",-119.53404,37.70124,MARIPOSA,2.0,neutral,neutral
596,1.9206515559563264e+17,2012-04-17,"@foxroano9T sinkholes, tsunamis (bear attacks happen near the mountains or rural areas) NOT IN LA! ahahaha!",137705926.0,3b77caf94bfc81fe,"Los Angeles, CA",-118.36518,33.99941,LOS ANGELES,2.0,fear,negative
597,1.924276177214013e+17,2012-04-18,News from @AP: Where's a Yellowstone bear? Look on your phone. http://t.co/6JO0OyUn,51330400.0,b82fa51f6957a1eb,"El Cajon, CA",-116.9225,32.80316,SAN DIEGO,2.0,neutral,neutral
598,1.9261174215568176e+17,2012-04-18,Where's a Yellowstone bear? Look on your phone http://t.co/xXc1bwtU,14411304.0,b71fac2ee9792cbe,"Sacramento, CA",-121.47887,38.566895,YOLO,2.0,neutral,neutral
599,1.9321399170577203e+17,2012-04-20,@matbonawang just because it's natural doesn't mean it's safe. You know what's also natural? A bear.,17108529.0,20ba6fb3b1ee82da,"Orange, CA",-117.849174,33.797485,ORANGE,2.0,neutral,neutral
600,19381601789.0,2010-07-24,Officials capture bear cub in tree http://bit.ly/cutM47 via http://outside.in/94558,16705281.0,c7d8b55f4023a144,"Berryessa, CA",-122.28965,38.670063,NAPA,2.0,neutral,neutral
601,19381601825.0,2010-07-24,Officials capture bear cub in tree http://bit.ly/aAfCrP via http://outside.in/94559,17151293.0,fbd6d2f5a4e4a15e,"California, USA",-119.31103,37.250366,MADERA,2.0,neutral,neutral
602,19728196953.0,2010-07-28,"in alaska While it is legal to shoot bears, waking a sleeping bear for the purpose of taking a photograph is prohibited.",37722131.0,ab2f2fac83aa388d,"Oakland, CA",-122.2622,37.77075,SAN FRANCISCO,2.0,neutral,neutral
603,1.9817519834687898e+17,2012-05-03,Oh boy theres another update on the bear family.  I can't wait to see the same shot of a bear hanging out in a tree.,83673201.0,3b77caf94bfc81fe,"Los Angeles, CA",-118.4545,34.154163,LOS ANGELES,2.0,joy,positive
604,2.0164051003992883e+17,2012-05-13,"Just saw a bear crossing the road. So random, but cool",109118691.0,ce4d6c69e5716f7b,"Auburn, CA",-121.06856,38.923584,PLACER,1.0,neutral,positive
605,2.0364578894394163e+17,2012-05-19,Black bear shot and killed by police after being hit by car on Hwy. 101 near Atascadero - http://t.co/ynHMFHdL #Atascadero #California,87321283.0,2bd8aff9ffdbc99a,"Atascadero, CA",-120.67033,35.507965,SAN LUIS OBISPO,1.0,fear,negative
606,2.0368820738315056e+17,2012-05-19,Mama Bear and her cubs! #cursegirls @jraeb8 @rmropeik   @ AT&amp;T Park http://t.co/BEAxdNJh,25910578.0,5c92ab5379de3839,"South Beach, San Francisco",-122.389404,37.77834,SAN FRANCISCO,1.0,fear,positive
607,2.0399592801161216e+17,2012-05-19,@9Seren9 There are actual bear warnings where I am! Doubt they've strayed as far as Southampton though!,17484168.0,1e52f04b9b18c166,"Colfax-Summit, CA",-120.23468,39.19684,PLACER,2.0,fear,neutral
608,2.042873889886208e+17,2012-05-20,how do people get mad when they get attacked by a bear or shark etc. when you in they backyard tho i mean they didnt walk into ur livin room,454696069.0,67248b5b4558dce9,"Long Beach, CA",-118.152954,33.8158,LOS ANGELES,2.0,anger,negative
609,2.048212905556828e+17,2012-05-22,"First and last time to camping at the forest, was a big nightmare :S i saw the black bear attacks someone at the midnight",427807663.0,ab2f2fac83aa388d,"Oakland, CA",-122.2622,37.77075,SAN FRANCISCO,1.0,fear,negative
610,2.0603790010051376e+17,2012-05-25,Lool another bear falls from a tree,56307115.0,2fd93ef04260afec,"Walnut, CA",-117.85066,34.0219,SAN BERNARDINO,2.0,neutral,negative
611,20656758497.0,2010-08-08,"We didn't actually encounter a bear but we were told that we were only a few yards from a mom & cub, good thing we didn't notice",175442129.0,1e52f04b9b18c166,"Colfax-Summit, CA",-120.567154,39.140213,PLACER,1.0,neutral,neutral
612,2.06979373671252e+17,2012-05-28,Bear Attacks Man in an Outhouse http://t.co/28mtdltb,30087621.0,cad414d9f9d60838,"Yosemite Valley, CA",-119.59471,37.74459,MARIPOSA,1.0,neutral,neutral
613,2.0721132939891507e+17,2012-05-28,"We found a BEAR in the woods! It tried to attack our car. It was so freakin  @ Flying High, Mammoth Mountain http://t.co/6VRhQKNO",26451240.0,b5a6e1185858e364,"Mono South, CA",-119.010765,37.68315,MONO,1.0,fear,negative
614,2.072710887056507e+17,2012-05-29,@cric8r you know how I keep complaining that what running is missing is the lack of chance of a bear attack. I think I know how to fix that.,50696815.0,ddcf75d883654021,"Clayton, CA",-121.916916,37.923504,CONTRA COSTA,2.0,neutral,negative
615,2.072852634650583e+17,2012-05-29,@cric8r there is a race up Mount Lassen through bear territory.  I should ask Figgy if she wants to be attacked by bears also?,50696815.0,d70cebab5f549266,"Pleasant Hill, CA",-122.057625,37.958614,CONTRA COSTA,2.0,neutral,neutral
616,2.0734160584010138e+17,2012-05-29,@AlonzoJewels Say u go camping and look out 4 a bear. Not finding one doesn't mean you won't wake to find one eating ur breakfast.,337343206.0,fbd6d2f5a4e4a15e,"California, USA",-119.31103,37.250366,MADERA,2.0,fear,neutral
617,2.0796293472965427e+17,2012-05-30,Sheriff's log: Black bear sighting in Greenfield - http://t.co/mtnjiTIT #Greenfield #California,87321283.0,fbd6d2f5a4e4a15e,"California, USA",-121.27573,36.320435,MONTEREY,1.0,fear,neutral
618,2.085922373308334e+17,2012-06-01,"Packin up and heading in the general direction of Yellowstone, although probably car camping there are bear warnings there and the Tetons.",50180822.0,fbd6d2f5a4e4a15e,"California, USA",-123.69305,38.981686,MENDOCINO,2.0,neutral,neutral
619,2.086892101342372e+17,2012-06-01,I practically bumped into a Brown Bear yesterday while hiking,252253027.0,21df9e4fdd7d3097,"Yosemite, CA",-119.53404,37.70124,MARIPOSA,1.0,neutral,positive
620,2.089479854999511e+17,2012-06-02,"Justice, Canadian style: ""Bear eats corpse of convicted murderer in Canada"" - via CNN http://t.co/RxnGNvVB",66437165.0,0c2e6999105f8070,"Anaheim, CA",-117.9143,33.80205,ORANGE,2.0,neutral,negative
621,2.0912538580221952e+17,2012-06-03,Last stop of the day. Sad to see Mr. Polar Bear pacing aimlessly.  @ Wild Arctic http://t.co/E6ttKRwj,20495074.0,a592bd6ceb1319f7,"San Diego, CA",-117.22293,32.76527,SAN DIEGO,2.0,sadness,negative
622,2.0921539404353126e+17,2012-06-03,Hoofing It into Bear Country - http://t.co/d0IIyjoM #Martinez #California,87321283.0,71d33f776fe41dfb,"Martinez, CA",-122.13413,38.019367,SOLANO,2.0,neutral,neutral
623,2.0969654808124208e+17,2012-06-04,Black bear euthanized after eating Canada murderer http://t.co/HxAxHqa5,14411304.0,b71fac2ee9792cbe,"Sacramento, CA",-121.47887,38.566895,YOLO,2.0,disgust,negative
624,2.097662797400023e+17,2012-06-04,"Grizzly bear attacks, kills llama http://t.co/ZnWnciAl",30087621.0,cad414d9f9d60838,"Yosemite Valley, CA",-119.59471,37.74459,MARIPOSA,1.0,neutral,negative
625,2.0998547298062336e+16,2011-01-01,Found a polar bear!  http://yfrog.com/hsiodwj,35080332.0,,,-121.97219,37.524216,SANTA CLARA,1.0,joy,positive
626,2.1045471661694976e+17,2012-06-06,There's a bear in them woods! #beartracks #ranchlife   @ Nojoqui Falls Ranch http://t.co/B9Fpr6Q5,297193004.0,ec19759a23d123e4,"Santa Ynez Valley, CA",-120.1889,34.53064,SANTA BARBARA,1.0,fear,neutral
627,21047403600.0,2010-08-13,#dontexpect me to go camping..i hate wildlife..hell if i get eatin by a bear!! fuck tht!!!,41709370.0,6ba08e404aed471f,"Riverside, CA",-117.39284,33.936188,RIVERSIDE,2.0,fear,negative
628,2.10974235215147e+17,2012-06-08,Bear walking.  http://t.co/Ngd6kCOS,34523546.0,1c382a37e6da5018,"Lake Tahoe, CA",-120.22196,39.13767,PLACER,2.0,neutral,neutral
629,2.1098627599237936e+17,2012-06-08,"California man tries to sell cubs after killing mother bear, authorities say http://t.co/tZISVAKo",30087621.0,cad414d9f9d60838,"Yosemite Valley, CA",-119.59471,37.74459,MARIPOSA,1.0,neutral,negative
630,2.111599568152208e+17,2012-06-08,Bear Cubs No Longer For Sale -Sacramento Bee http://t.co/HHnpp2uz #Whitney #Rocklin #CA,468670963.0,b37d3f2758ab6f61,"Carmichael, CA",-121.316246,38.620247,SACRAMENTO,2.0,fear,neutral
631,21131410352.0,2010-08-14,Zoo euthanizes polar bear http://bit.ly/d5zWOb via http://outside.in/94132,17153684.0,78a2b1d0a8a834f5,"Stonestown Apartments, San Francisco",-122.46738,37.676807,SAN MATEO,2.0,neutral,negative
632,21141792796.0,2010-08-14,SF Zoo Euthanizes Polar Bear With Cancer http://bit.ly/bT7OL4 via http://outside.in/94132,17153684.0,78a2b1d0a8a834f5,"Stonestown Apartments, San Francisco",-122.46738,37.676807,SAN MATEO,2.0,neutral,neutral
633,21141793113.0,2010-08-14,SF Zoo Euthanizes Polar Bear With Cancer http://bit.ly/aRFn1l via http://outside.in/94132,17153684.0,78a2b1d0a8a834f5,"Stonestown Apartments, San Francisco",-122.46738,37.676807,SAN MATEO,2.0,neutral,neutral
634,21141793238.0,2010-08-14,S.F. Zoo polar bear euthanized http://bit.ly/a2vHZB via http://outside.in/94132,17153684.0,78a2b1d0a8a834f5,"Stonestown Apartments, San Francisco",-122.46738,37.676807,SAN MATEO,2.0,neutral,negative
635,21141793282.0,2010-08-14,Zoo officials euthanize Andy the polar bear http://bit.ly/bWSrh7 via http://outside.in/94132,17153684.0,78a2b1d0a8a834f5,"Stonestown Apartments, San Francisco",-122.46738,37.676807,SAN MATEO,2.0,neutral,negative
636,21190537815.0,2010-08-15,Polar bear euthanized at San Francisco Zoo http://bit.ly/bJVwz4 via http://outside.in/94132,17153684.0,78a2b1d0a8a834f5,"Stonestown Apartments, San Francisco",-122.46738,37.676807,SAN MATEO,2.0,neutral,negative
637,21190537915.0,2010-08-15,SF Zoo Mourns Andy The Polar Bear http://bit.ly/9PGNsC via http://outside.in/94132,17153684.0,78a2b1d0a8a834f5,"Stonestown Apartments, San Francisco",-122.46738,37.676807,SAN MATEO,2.0,neutral,neutral
638,21190545347.0,2010-08-15,"Days from Death, Bear Cub Freed From Plastic Jar http://bit.ly/aVQddS via http://outside.in/95127",16705944.0,fbd6d2f5a4e4a15e,"California, USA",-119.31103,37.250366,MADERA,2.0,neutral,neutral
639,21190622216.0,2010-08-15,Plastic jar removed from Florida bear cub's head http://bit.ly/99rU02 via http://outside.in/95127,16705944.0,fbd6d2f5a4e4a15e,"California, USA",-119.31103,37.250366,MADERA,2.0,neutral,neutral
640,21212628889.0,2010-08-15,Plastic jar removed from Florida bear cub's head http://bit.ly/9ZBEZQ via http://outside.in/95148,16963299.0,fbd6d2f5a4e4a15e,"California, USA",-119.31103,37.250366,MADERA,2.0,neutral,neutral
641,21218193179.0,2010-08-15,'JARHEAD' RESCUED: Bear cub can eat and drink again after 10 days with head stuck in plasti http://bit.ly/aAnt3c via http://outside.in/95127,16705944.0,fbd6d2f5a4e4a15e,"California, USA",-119.31103,37.250366,MADERA,2.0,neutral,neutral
642,21218193185.0,2010-08-15,'JARHEAD' RESCUED: Bear cub can eat and drink again after 10 days with head stuck in plasti http://bit.ly/bBki9T via http://outside.in/95148,16963299.0,fbd6d2f5a4e4a15e,"California, USA",-119.31103,37.250366,MADERA,2.0,neutral,neutral
643,2.122278526896087e+17,2012-06-11,"@__pbh in French we say ""don't kill the bear's skin before killing it"". Ah!",17877879.0,2b6ff8c22edd9576,"SoMa, San Francisco",-122.40445,37.782364,SAN FRANCISCO,2.0,fear,negative
644,21223109688.0,2010-08-15,Plastic jar removed from Florida bear cub's head http://bit.ly/brqAi9 via http://outside.in/95127,16705944.0,fbd6d2f5a4e4a15e,"California, USA",-119.31103,37.250366,MADERA,2.0,neutral,neutral
645,21223109933.0,2010-08-15,Plastic jar removed from Florida bear cub's head http://bit.ly/9SaZC5 via http://outside.in/95148,16963299.0,fbd6d2f5a4e4a15e,"California, USA",-119.31103,37.250366,MADERA,2.0,neutral,neutral
646,21273377640.0,2010-08-16,Jar removed from Florida bear cub's head http://bit.ly/apfGwc via http://outside.in/95127,16705944.0,fbd6d2f5a4e4a15e,"California, USA",-119.31103,37.250366,MADERA,2.0,neutral,neutral
647,21273379143.0,2010-08-16,Jar removed from Florida bear cub's head http://bit.ly/c9EAbF via http://outside.in/95148,16963299.0,fbd6d2f5a4e4a15e,"California, USA",-119.31103,37.250366,MADERA,2.0,neutral,neutral
648,2.130332870132368e+17,2012-06-13,"Great morning of filming with @danielsutton10 for Ch10. Saw a bear, ran some roads and trails, iced in the lake and chatted to @hamishNews.",173355140.0,59aa59a4f640381b,"Mammoth Lakes, CA",-118.98569,37.651188,MONO,1.0,neutral,positive
649,2.1334661229302576e+17,2012-06-14,Going on a bear hunt....,39890591.0,8f48e7f383f82d54,"Bishop, CA",-118.394684,37.36534,INYO,2.0,neutral,neutral
650,2.1359718267736883e+17,2012-06-15,Bear do attack humans. #mauling,568772881.0,e868cf904e518ff4,"Palmdale, CA",-118.04529,34.567932,LOS ANGELES,2.0,fear,negative
651,2.1413612175033136e+17,2012-06-16,My parents are in North Georgia right now and they were just actually pursued by a bear. They exited.,128351017.0,5a110d312052166f,"San Francisco, CA",-122.47957,37.766644,SAN FRANCISCO,2.0,neutral,negative
652,2.144417751489659e+17,2012-06-17,Yesterday I saw a bear #thankyouyosemite http://t.co/RynGxtGN,39890591.0,fbd6d2f5a4e4a15e,"California, USA",-122.38683,37.61501,SAN MATEO,2.0,joy,positive
653,2.1495915729872896e+17,2012-06-19,"Fawk I think that damn bear is giving me a rash Dx cus I keep scratching my arm and stuff fml I hate how sensitive 
My skin is ugh!!",101631061.0,67571a7baaa5906b,"East Los Angeles, CA",-118.184296,34.026047,LOS ANGELES,2.0,disgust,negative
654,2.151776961776968e+17,2012-06-19,"Spotted one bear, a wolf, three deers, lots of squirrels, birds and butterflies. That was amazing.",39488038.0,b5a6e1185858e364,"Mono South, CA",-118.623886,37.784203,MONO,1.0,joy,positive
655,21679501301.0,2010-08-20,"Just got back from our #dailydogwalk. Sophie, Pierre and I saw a baby bear in a tree. Michelle's at the bowl walking Daisy and Bailey. Woof.",53188907.0,174309ec90de94d0,"Monrovia, CA",-118.03603,34.174534,LOS ANGELES,1.0,joy,neutral
656,2.172628369451336e+17,2012-06-25,@SmashSquadMMA @th_chaos oh geeze...how can people not see its a bear,388615519.0,41c331abe42d9969,"Apple Valley, CA",-117.21737,34.529682,SAN BERNARDINO,2.0,sadness,negative
657,2.1769923822893466e+17,2012-06-26,Love this bear! http://t.co/1ojf1cuy,37149284.0,fbd6d2f5a4e4a15e,"California, USA",-118.57732,34.383945,LOS ANGELES,2.0,joy,positive
658,2.178251501109248e+17,2012-06-27,when a bear attacks our trash can :O #well #almost,259458457.0,2ca541fefabe94d6,"Arcata, CA",-124.07568,40.89146,HUMBOLDT,2.0,fear,negative
659,2.1785531957183283e+17,2012-06-27,fucking polar bear. car's always freezing balls,376626001.0,07dccb89e8f25a8f,"Downey, CA",-118.14064,33.958652,LOS ANGELES,2.0,anger,negative
660,2.189841058309243e+17,2012-06-30,"@stephhyq if I could survive yosemite, I could survive a bear.. I got this!!!:)",108781443.0,213d0db04acb674d,"Truckee, CA",-120.21871,39.34895,PLACER,2.0,joy,positive
661,2.190891137967063e+17,2012-06-30,@spacemansam It's okay. He's a friendly bear.,123946225.0,3b77caf94bfc81fe,"Los Angeles, CA",-118.217354,34.06369,LOS ANGELES,2.0,neutral,positive
662,2.191981625465979e+17,2012-06-30,"Mom, that bear is badass.",14168218.0,fbd6d2f5a4e4a15e,"California, USA",-121.05479,39.2425,NEVADA,2.0,neutral,positive
663,2.193394406807388e+17,2012-07-01,u heard the bear http://t.co/qfKUpEPl,5774782.0,a592bd6ceb1319f7,"San Diego, CA",-117.10973,32.801037,SAN DIEGO,2.0,neutral,neutral
664,2.2056195742040883e+17,2012-07-04,@daisy ha. I think that house was next to our house two seasons ago when we had the famous bear break-in-plus-dump-on-carpet incident.,14589956.0,62fb48acdf6bd915,"Noe Valley, San Francisco",-122.42311,37.753086,SAN FRANCISCO,1.0,neutral,neutral
