,tweet_id,created_datetime,content,author_id,place_id,location,longitude,latitude,county,label,sentiment_1,sentiment_2
1891,7.327647250590515e+17,2016-05-18,Today I saw a bear via my rear vision mirror whilst on the phone to @Bell_Pop overhearing me losing my shit with excitement. It ran away ðŸ˜ž,442279321.0,fbd6d2f5a4e4a15e,"California, USA",-119.31103,37.250366,MADERA,1.0,fear,negative
1892,7.334614949610332e+17,2016-05-20,"Going to Yosemite for my 4th time this summer n if I still don't see a bear, Imma be pissed",1558714668.0,d07feb9e5b1ce37c,"Westminster, CA",-117.99295,33.72288,ORANGE,2.0,anger,negative
1893,7.347888453388206e+17,2016-05-23,It's dope how you can see a bear on the California ID when you hold it in light,212668635.0,d52c2a8e878b7cf7,"Hesperia, CA",-117.267586,34.4292,SAN BERNARDINO,2.0,neutral,positive
1894,7.361757436427018e+17,2016-05-27,"Off to the redwoods for a camping adventure! I've seen The Revenant, so I know what to do in case of bear attacks.",2571857910.0,3d533362cdab8107,"Irvine, CA",-117.831535,33.719917,ORANGE,2.0,neutral,neutral
1895,7.372968330393723e+17,2016-05-30,"I was so excited yesterday bc I saw a bear with her cub in the mountainsðŸ˜ðŸ˜ they were playing, so cuteðŸ˜­ðŸ˜­ðŸ’œ",3236597629.0,9f8bd34c144e52ee,"Selma, CA",-119.65261,36.622078,FRESNO,1.0,joy,positive
1896,7.37726975742087e+17,2016-05-31,"Things you don't hear very often: ""I got chased by a bear this weekend."" #wildman",15939057.0,a409256339a7c6a1,"Redwood City, CA",-122.25409,37.500957,SAN MATEO,1.0,fear,negative
1897,7.400158154711777e+17,2016-06-07,Random bear sightings in Silverlake (it's a costume),159670521.0,3b77caf94bfc81fe,"Los Angeles, CA",-118.36518,33.99941,LOS ANGELES,2.0,neutral,neutral
1898,7.406032216478433e+17,2016-06-08,@E_SGVScanner Now it's getting closer to where I saw a bear in my youth! They eventually had to tranq it in a tree.,122280516.0,7d62cffe6f98f349,"San Jose, CA",-121.90978,37.32701,SANTA CLARA,1.0,surprise,neutral
1899,7.403942222856233e+17,2016-06-08,"Watching the bachelorette and my mom saw a bear and said ""what brand of bear is that""..i don't know mom maybe Steve Madden ðŸ’ðŸ¼@JenniferMShear",1622190127.0,26595dca9d293375,"Yorba Linda, CA",-117.82659,33.900215,SAN BERNARDINO,2.0,joy,neutral
1900,7.409793769640182e+17,2016-06-09,I saw a bear at work today. @oddyungthug,174179617.0,3b77caf94bfc81fe,"Los Angeles, CA",-118.36518,33.99941,LOS ANGELES,1.0,fear,neutral
1901,7.412766986547159e+17,2016-06-10,This is what NOT to do if you ever see a bear lol. Probably should have yelled at it... It gotâ€¦ https://t.co/hQrTuKFimP,384256419.0,fbd6d2f5a4e4a15e,"California, USA",-120.10914,38.953617,EL DORADO,2.0,neutral,negative
1902,7.417451329117594e+17,2016-06-11,Done. We all had a great race. There was even a bear sighting #journeytojavelinaâ€¦ https://t.co/P9NUsiE0oF,16422729.0,fbd6d2f5a4e4a15e,"California, USA",-119.639,37.4786,MARIPOSA,1.0,joy,positive
1903,7.42057416901034e+17,2016-06-12,"@mbushong Take out the bear attack and no one talks about this movie. Oh, and apparently hypothermia doesn't exist in the 1820's...",14459093.0,6a4364ea6f987c10,"Los Altos, CA",-122.137024,37.36814,SANTA CRUZ,2.0,anger,negative
1904,7.436094144693331e+17,2016-06-17,"@kevinmeyers uhhh, did you see the bear attack scene?",22097962.0,5a110d312052166f,"San Francisco, CA",-122.47957,37.766644,SAN FRANCISCO,2.0,surprise,neutral
1905,7.450860824929894e+17,2016-06-21,My dad hit a bear today ðŸ˜‚,3017505769.0,fbd6d2f5a4e4a15e,"California, USA",-119.31103,37.250366,MADERA,1.0,fear,neutral
1906,7.453664416505939e+17,2016-06-21,We seen a bear amglaze @AlliedMultisprt @skratchlabs @ San Gorgonioâ€¦ https://t.co/CqlosaXOhW,140286078.0,fbd6d2f5a4e4a15e,"California, USA",-116.83479,34.104412,SAN BERNARDINO,1.0,fear,neutral
1907,7.452730372855153e+17,2016-06-21,"If you see a bear cub, try to catch it so you can draw it like one of your French girls.
#BadCampingAdvice",3641711594.0,a592bd6ceb1319f7,"San Diego, CA",-117.10973,32.801037,SAN DIEGO,2.0,neutral,neutral
1908,7.458190420118118e+17,2016-06-23,It's not everyday you are close enough to see a bear. This guy was on a mission to find someâ€¦ https://t.co/h8gNFIEsV6,289333380.0,fbd6d2f5a4e4a15e,"California, USA",-118.77583,36.56171,TULARE,1.0,neutral,neutral
1909,7.458687697093958e+17,2016-06-23,Hahaha I was hoping to see a bear and then my mom saw one by our cabin LMAO,4185042494.0,0056a5ad3ac63b03,"South Lake Tahoe, CA",-119.98818,38.871613,EL DORADO,1.0,neutral,positive
1910,7.468927391537971e+17,2016-06-26,I just want to see a bear...,2847805717.0,07d9ecbfd3888005,Yosemite National Park,-119.533485,37.791195,MARIPOSA,2.0,neutral,neutral
1911,7.471133825583268e+17,2016-06-26,I'm really jealous of all the people that have seen a bear up close,354716362.0,80eb17ffe368fc9a,"Huntington Beach, CA",-118.04654,33.723835,ORANGE,2.0,anger,negative
1912,7.47200226591531e+17,2016-06-26,@JoyMaxxi expect mo talaga to see a bear? ðŸ˜..,7.104692370730312e+17,fbd6d2f5a4e4a15e,"California, USA",-119.31103,37.250366,MADERA,2.0,neutral,neutral
1913,7.479769922517729e+17,2016-06-29,Between bear attacks and wildfires I'm having quite the eventful week.,2268294013.0,fbd6d2f5a4e4a15e,"California, USA",-119.31103,37.250366,MADERA,1.0,neutral,negative
1914,7.486546616414618e+17,2016-06-30,That one time when you see a bear in #Yosemite and it's awesome!â€¦ https://t.co/7SkP57uSYL,374331658.0,fbd6d2f5a4e4a15e,"California, USA",-119.587234,37.748646,MARIPOSA,1.0,joy,positive
1915,7.493685745112269e+17,2016-07-02,The time a bear attacked a quinceaÃ±era fiesta. #Hanford @ Civic Center Auditorium https://t.co/8oOoLqSpUw,17957736.0,17c553c1a9dd0466,"Hanford, CA",-119.64681,36.32898,KINGS,1.0,fear,negative
1916,7.498438820079288e+17,2016-07-04,I just seen a bear,2916051528.0,0056a5ad3ac63b03,"South Lake Tahoe, CA",-119.98818,38.871613,EL DORADO,1.0,fear,neutral
1917,7.50544410484609e+17,2016-07-06,hahaha saw a bear hiking today and almost cried,852052430.0,80eb17ffe368fc9a,"Huntington Beach, CA",-118.04654,33.723835,ORANGE,1.0,joy,neutral
1918,7.507962037224366e+17,2016-07-06,"Isolated. Flimsy. Vulnerable to bear attacks. Does this describe your online presence?
Let's change that! #webdesign https://t.co/7duU5b26a5",82572489.0,2417f030a58de0ce,"Hollister, CA",-121.44915,36.883636,SAN BENITO,2.0,fear,negative
1919,7.516216883164243e+17,2016-07-09,Just saw a bear at our cabin... In our backyard haha,56585785.0,fbd6d2f5a4e4a15e,"California, USA",-119.31103,37.250366,MADERA,1.0,joy,positive
1920,7.521376616163e+17,2016-07-10,That time you see a bear outside the house. Welcome to Tahoe. ðŸ» @ South Lake Tahoe https://t.co/Q20dtfknvn,10690222.0,0056a5ad3ac63b03,"South Lake Tahoe, CA",-120.01356,38.85559,EL DORADO,1.0,fear,positive
1921,7.53351304181723e+17,2016-07-13,I just saw a bear crossing sign. WHERE DA BEARS AT ðŸ»ðŸ»ðŸ»ðŸ»ðŸ»,25010917.0,fbd6d2f5a4e4a15e,"California, USA",-119.31103,37.250366,MADERA,2.0,fear,neutral
1922,7.541397140687667e+17,2016-07-16,"When you see a bear cub and it's mother isn't anywhere to be found, you clearly go up and try to pet it @turbulation https://t.co/6JSfhJoeDH",499455740.0,f9c0877820b7848a,"Santa Clarita, CA",-118.464645,34.451508,LOS ANGELES,1.0,anger,neutral
1923,7.551566725327831e+17,2016-07-18,I saw a bear #timehop https://t.co/VNlZz4OPht,58986128.0,a592bd6ceb1319f7,"San Diego, CA",-117.10973,32.801037,SAN DIEGO,1.0,fear,neutral
1924,7.55293729221587e+17,2016-07-19,I saw a bear in our first run ðŸ˜°ðŸ˜±ðŸ˜±ðŸ˜‚ðŸ˜‚ https://t.co/jUE7jLMOAg,2612412043.0,59aa59a4f640381b,"Mammoth Lakes, CA",-118.967445,37.607735,MONO,1.0,fear,negative
1925,7.552940984755405e+17,2016-07-19,I leave tomorrow and I still haven't seen a bear I'm so sad,3318471001.0,59aa59a4f640381b,"Mammoth Lakes, CA",-118.967445,37.607735,MONO,2.0,sadness,negative
1926,7.556064226211963e+17,2016-07-20,"My daughter is still in Alaska, she said she saw a bear today. His name was Craig! :)",571925138.0,2bd8aff9ffdbc99a,"Atascadero, CA",-120.650375,35.45074,SAN LUIS OBISPO,1.0,joy,positive
1927,7.55643587006718e+17,2016-07-20,Do u have a plan when u see a bear in the woods? https://t.co/WJwoyCt51S #HikingTrip #tips #Wilderness https://t.co/NEtA44yhGy,2897696762.0,0056a5ad3ac63b03,"South Lake Tahoe, CA",-119.98818,38.871613,EL DORADO,2.0,fear,neutral
1928,7.557804400913531e+17,2016-07-20,@Tour_is when hiking do u know what to do when u see a bear? https://t.co/WJwoyCbtDi,2897696762.0,0056a5ad3ac63b03,"South Lake Tahoe, CA",-119.98818,38.871613,EL DORADO,2.0,fear,neutral
1929,7.557805066171269e+17,2016-07-20,@Adventfishking when hiking do u know what to do when u see a bear? https://t.co/WJwoyCbtDi,2897696762.0,0056a5ad3ac63b03,"South Lake Tahoe, CA",-119.98818,38.871613,EL DORADO,2.0,fear,neutral
1930,7.557805495793747e+17,2016-07-20,@HappsHealthHome when hiking do u know what to do when u see a bear? https://t.co/WJwoyCbtDi,2897696762.0,0056a5ad3ac63b03,"South Lake Tahoe, CA",-119.98818,38.871613,EL DORADO,2.0,fear,neutral
1931,7.557806215284654e+17,2016-07-20,@LLLLifeCoaching when hiking do u know what to do when u see a bear? https://t.co/WJwoyCbtDi,2897696762.0,0056a5ad3ac63b03,"South Lake Tahoe, CA",-119.98818,38.871613,EL DORADO,2.0,fear,neutral
1932,7.557806449662483e+17,2016-07-20,@MilenaValentino when hiking do u know what to do when u see a bear? https://t.co/WJwoyCbtDi,2897696762.0,0056a5ad3ac63b03,"South Lake Tahoe, CA",-119.98818,38.871613,EL DORADO,2.0,fear,neutral
1933,7.557806937124371e+17,2016-07-20,@xrobspencerx when hiking do u know what to do when u see a bear? https://t.co/WJwoyCbtDi,2897696762.0,0056a5ad3ac63b03,"South Lake Tahoe, CA",-119.98818,38.871613,EL DORADO,2.0,fear,neutral
1934,7.557807882436977e+17,2016-07-20,"@hikingambition good question. Also, when hiking do u know what to do when u see a bear? https://t.co/WJwoyCbtDi",2897696762.0,0056a5ad3ac63b03,"South Lake Tahoe, CA",-119.98818,38.871613,EL DORADO,2.0,neutral,neutral
1935,7.557809375609569e+17,2016-07-20,@silvioantoniak when hiking do u know what to do when u see a bear? https://t.co/WJwoyCbtDi,2897696762.0,0056a5ad3ac63b03,"South Lake Tahoe, CA",-119.98818,38.871613,EL DORADO,2.0,fear,neutral
1936,7.557809768909578e+17,2016-07-20,@LavenderHytta when hiking do u know what to do when u see a bear? https://t.co/WJwoyCbtDi,2897696762.0,0056a5ad3ac63b03,"South Lake Tahoe, CA",-119.98818,38.871613,EL DORADO,2.0,fear,neutral
1937,7.557810097407468e+17,2016-07-20,@campingislife4 when hiking do u know what to do when u see a bear? https://t.co/WJwoyCbtDi,2897696762.0,0056a5ad3ac63b03,"South Lake Tahoe, CA",-119.98818,38.871613,EL DORADO,2.0,fear,neutral
1938,7.557810989787585e+17,2016-07-20,@NDMArtistry @NikonUSA awesome photo when hiking do u know what to do when u see a bear? https://t.co/WJwoyCbtDi,2897696762.0,0056a5ad3ac63b03,"South Lake Tahoe, CA",-119.98818,38.871613,EL DORADO,2.0,joy,positive
1939,7.557812339640484e+17,2016-07-20,@ObozFootwear @AHealingMama congrats on losing the weight.  when hiking do u know what to do when u see a bear? https://t.co/WJwoyCbtDi,2897696762.0,0056a5ad3ac63b03,"South Lake Tahoe, CA",-119.98818,38.871613,EL DORADO,2.0,joy,positive
1940,7.557813256640717e+17,2016-07-20,@bfgreen when hiking do u know what to do when u see a bear? https://t.co/WJwoyCbtDi,2897696762.0,0056a5ad3ac63b03,"South Lake Tahoe, CA",-119.98818,38.871613,EL DORADO,2.0,fear,neutral
1941,7.557813670702734e+17,2016-07-20,@campingislife3 when hiking do u know what to do when u see a bear? https://t.co/WJwoyCbtDi,2897696762.0,0056a5ad3ac63b03,"South Lake Tahoe, CA",-119.98818,38.871613,EL DORADO,2.0,fear,neutral
1942,7.55781399458648e+17,2016-07-20,@AlBocian @GrandCanyonNPS @CelsiusOfficial when hiking do u know what to do when u see a bear? https://t.co/WJwoyCbtDi,2897696762.0,0056a5ad3ac63b03,"South Lake Tahoe, CA",-119.98818,38.871613,EL DORADO,2.0,fear,neutral
1943,7.557814306433473e+17,2016-07-20,@nansanpo when hiking do u know what to do when u see a bear? https://t.co/WJwoyCbtDi,2897696762.0,0056a5ad3ac63b03,"South Lake Tahoe, CA",-119.98818,38.871613,EL DORADO,2.0,fear,neutral
1944,7.557814557839974e+17,2016-07-20,@ArtforActivism when hiking do u know what to do when u see a bear? https://t.co/WJwoyCbtDi,2897696762.0,0056a5ad3ac63b03,"South Lake Tahoe, CA",-119.98818,38.871613,EL DORADO,2.0,fear,neutral
1945,7.557814875684004e+17,2016-07-20,@christineispink when hiking do u know what to do when u see a bear? https://t.co/WJwoyCbtDi,2897696762.0,0056a5ad3ac63b03,"South Lake Tahoe, CA",-119.98818,38.871613,EL DORADO,2.0,fear,neutral
1946,7.557815542159237e+17,2016-07-20,@ChristopherPry when hiking do u know what to do when u see a bear? https://t.co/WJwoyCbtDi,2897696762.0,0056a5ad3ac63b03,"South Lake Tahoe, CA",-119.98818,38.871613,EL DORADO,2.0,fear,neutral
1947,7.564749077314724e+17,2016-07-22,@TheOnion media spoofs of coverage of bear attacks may be glossed over by bear media moguls. who attack for no reason.,376335848.0,1193edda55d6fa3d,"West Covina, CA",-117.92995,34.082493,LOS ANGELES,2.0,neutral,negative
1948,7.566132372782817e+17,2016-07-22,Thank you random #Starbucks man for telling me how #Lululemon pants saved you from a bear attack &amp; giving me an #elbowfive. #FridayFeeling,2315152958.0,5a110d312052166f,"San Francisco, CA",-122.47957,37.766644,SAN FRANCISCO,2.0,joy,positive
1949,7.566992506003128e+17,2016-07-23,Bryan hit a bear wit a turd fork a few weeks ago,984112554.0,fbd6d2f5a4e4a15e,"California, USA",-119.31103,37.250366,MADERA,1.0,neutral,neutral
1950,7.570505548455076e+17,2016-07-24,saw a bear during dinner tonight! #LakeTahoe #CampRichardson https://t.co/ixg9qbdfR4,36231757.0,0056a5ad3ac63b03,"South Lake Tahoe, CA",-119.98818,38.871613,EL DORADO,1.0,fear,neutral
1951,7.592129680893624e+17,2016-07-30,25 bear sightings in 7 days hey this is be fun thanks lake tahoe,350750089.0,fbd6d2f5a4e4a15e,"California, USA",-119.31103,37.250366,MADERA,1.0,joy,positive
1952,7.59767570320855e+17,2016-07-31,Finally saw a bear!! Love being in the great outdoors. #mammothmountain #mammothlakesâ€¦ https://t.co/7MxvOBWuLY,95428029.0,fbd6d2f5a4e4a15e,"California, USA",-119.0072,37.61664,MONO,1.0,joy,positive
1953,7.601561537372037e+17,2016-08-01,What yall doing you leave yo room &amp; you see a bear running at you like this? https://t.co/kXtrTiOKED,379446477.0,b71fac2ee9792cbe,"Sacramento, CA",-121.48253,38.592644,YOLO,1.0,disgust,negative
1954,7.617294117627085e+17,2016-08-06,"I swear Amber is the only one who would see a bear ,try to run away fall but hit her head on a rock, knock herself out &amp; get a concussion ðŸ˜‚ðŸ˜‚",1607626309.0,a89175c4c91f45a3,"Citrus Heights, CA",-121.254196,38.685196,SACRAMENTO,1.0,fear,negative
1955,7.618451054518598e+17,2016-08-06,I just saw a bear walk in front of me and then raid a trash can ðŸ»,369746334.0,0056a5ad3ac63b03,"South Lake Tahoe, CA",-119.98818,38.871613,EL DORADO,1.0,disgust,negative
1956,7.628518335890924e+17,2016-08-09,If I don't see a bear when I go to Yosemite I will be slightly disappointed,2211653149.0,cf2d9d01f16e9bd4,"Chino, CA",-117.71591,33.988228,SAN BERNARDINO,2.0,neutral,negative
1957,7.634247766982451e+17,2016-08-10,I wanna see a bearðŸ»,2458747099.0,012cf25774f836cd,"La Quinta, CA",-116.322556,33.680996,RIVERSIDE,2.0,joy,positive
1958,7.63588682624344e+17,2016-08-11,Ready to be chased by a bear with Azhly ðŸ˜œðŸ˜‚ðŸ˜‚,2816241067.0,fbd6d2f5a4e4a15e,"California, USA",-119.31103,37.250366,MADERA,2.0,neutral,neutral
1959,7.651856435592641e+17,2016-08-15,#NBCNews 2nd bear sighting in Glendale in 2 weeks https://t.co/P1ppoZOCNr,2551786842.0,3b77caf94bfc81fe,"Los Angeles, CA",-118.36518,33.99941,LOS ANGELES,1.0,fear,neutral
1960,7.651860592190628e+17,2016-08-15,#abc7eyewitness 2nd bear sighting in Glendale in the past 2 weeks https://t.co/WjiHiD8Hjs,2551786842.0,3b77caf94bfc81fe,"Los Angeles, CA",-118.36518,33.99941,LOS ANGELES,1.0,fear,neutral
1961,7.653773637817793e+17,2016-08-16,"In the end the summer road trip was a success! No broken bones, missing limbs, or bear attacksâ€¦ https://t.co/h68dB7kRHg",14079986.0,fbd6d2f5a4e4a15e,"California, USA",-121.45534,35.88426,MONTEREY,2.0,joy,positive
1962,7.657842118821478e+17,2016-08-17,I'm just trying to get tan and see a bear this week then cuddle non stop with my dog.,45484087.0,0056a5ad3ac63b03,"South Lake Tahoe, CA",-119.98818,38.871613,EL DORADO,2.0,neutral,positive
1963,7.670917451966177e+17,2016-08-20,Just saw a bear in front of my parents' house ðŸ» https://t.co/srL4Cr6cGf,49339259.0,174309ec90de94d0,"Monrovia, CA",-118.03603,34.174534,LOS ANGELES,1.0,fear,neutral
1964,7.677428498320014e+17,2016-08-22,"This weekend I saw a bear and her lil cubs walkin around, but that's nothing compared to trying not to fall asleep at my desk right now.",37380584.0,3b77caf94bfc81fe,"Los Angeles, CA",-118.599754,34.252525,LOS ANGELES,1.0,disgust,neutral
1965,7.692423231589581e+17,2016-08-26,Fun time last night performing in Mammoth. No bear attacks stories unfortunately - back on stageâ€¦ https://t.co/Tqh9XZ6NQk,43087439.0,fbd6d2f5a4e4a15e,"California, USA",-119.03741,37.651024,MONO,2.0,joy,positive
1966,7.703622675985981e+17,2016-08-29,It's true! Yesterday I saw a bear ðŸŒ²ðŸ» #attention #bear #sign #nationalpark #sequoianationalparkâ€¦ https://t.co/khvYpLTAtu,84312128.0,fbd6d2f5a4e4a15e,"California, USA",-118.785614,36.546486,TULARE,1.0,fear,positive
1967,7.751614196248781e+17,2016-09-12,'I see a bear it's a bear it's a bear' @ Sequioa National Park https://t.co/4vtKCLpvk7,1369659949.0,fbd6d2f5a4e4a15e,"California, USA",-118.75207,36.609642,TULARE,1.0,fear,neutral
1968,7.754689037869587e+17,2016-09-12,I really dreamt that a bear attacked me last night... Don't do marijuana kids.,1535400680.0,5a9de3ff3fdd849d,"Santa Rosa, CA",-122.62832,38.4832,SONOMA,2.0,fear,negative
1969,7.768228172833055e+17,2016-09-16,"We're hitting the road again! Bye Tahoe, it was GREAT! Never saw a bear, but that's probably forâ€¦ https://t.co/rrBNrRSjkj",14827773.0,fbd6d2f5a4e4a15e,"California, USA",-120.12283,38.8078,EL DORADO,2.0,joy,positive
1970,7.77203475553792e+17,2016-09-17,Last morning in Lake Tahoe with these two - bear sightings and day hikes gone wrong - an actionâ€¦ https://t.co/Ce2VdxMlVy,70675668.0,00c517054d026dbb,"Sunnyside, CA",-120.15466,39.13982,PLACER,1.0,neutral,negative
1971,7.774378618763387e+17,2016-09-18,Why did I just watch the bear attack scene in Revenant wtf,47830899.0,38ea9782c8d83a4b,"Marina del Rey, CA",-118.47271,34.00091,LOS ANGELES,2.0,surprise,negative
1972,7.824345029624054e+17,2016-10-02,"@acornsandnuts This ""true story"" guy might've survived a bear attack, but not like this.",605117532.0,5a110d312052166f,"San Francisco, CA",-122.47957,37.766644,SAN FRANCISCO,2.0,neutral,negative
1973,7.827908571665121e+17,2016-10-03,@joerogan bear attack!! This dude is lucky to be alive! https://t.co/4uurc0QDJW,97065616.0,4caadee2bfd4ee70,"Rosedale, CA",-119.2177,35.35989,KERN,1.0,joy,positive
1974,7.838198573640663e+17,2016-10-06,Never did i think id see a bear belly flop https://t.co/9VB8tUmlNw,2542595756.0,5ef5b7f391e30aff,"Berkeley, CA",-122.264915,37.860676,CONTRA COSTA,2.0,neutral,negative
1975,7.855434041637028e+17,2016-10-10,right now i thought i saw a bear outside of my house but it was just a bush,158974347.0,e9b2c8beb5442ec5,"Bellflower, CA",-118.15085,33.905952,LOS ANGELES,1.0,fear,neutral
1976,7.8582332650974e+17,2016-10-11,250lb black bear spotted this morning near Bailey Cyn where bear attacked man hiking yesterday #sierramadre @CBSLA https://t.co/1mW7fQNNMC,41229084.0,712ece9c3ad485de,"Sierra Madre, CA",-118.03603,34.174534,LOS ANGELES,1.0,fear,neutral
1977,7.858170585964298e+17,2016-10-11,Man explains how he survived terrifying double bear attack inÂ California https://t.co/02ScHtmJDG,23517712.0,712ece9c3ad485de,"Sierra Madre, CA",-118.05285,34.161674,LOS ANGELES,2.0,fear,neutral
1978,7.85911434945323e+17,2016-10-11,"Incredible: Hiker might have triggered bear attack by interrupting mating session, official says https://t.co/38H3InkB3j by @JosephSerna",24596887.0,3b77caf94bfc81fe,"Los Angeles, CA",-118.36518,33.99941,LOS ANGELES,2.0,neutral,negative
1979,7.866704243775324e+17,2016-10-13,"@corbydavidson @theoldgreywolf 84 Lamar Grad here, the bear attack was at the 1/2 mark of my daily walk. Because of the drought.",1289966790.0,712ece9c3ad485de,"Sierra Madre, CA",-118.03603,34.174534,LOS ANGELES,1.0,fear,neutral
1980,7.880884546136556e+17,2016-10-17,@Leon_asKing lol yeah bro they swore they saw a bear on 10st ðŸ˜‚ðŸ˜‚ðŸ˜‚ðŸ˜‚ðŸ˜‚ðŸ˜‚,307989298.0,3b77caf94bfc81fe,"Los Angeles, CA",-118.36518,33.99941,LOS ANGELES,1.0,fear,neutral
1981,7.882027224324301e+17,2016-10-18,"went to a wellness dr 2day who did multiple tests on me &amp; it turns out im ""as stressed as someone who is constantly being chased by a bear""",41167428.0,3b77caf94bfc81fe,"Los Angeles, CA",-118.36518,33.99941,LOS ANGELES,2.0,anger,negative
1982,7.882427043290808e+17,2016-10-18,Pedals bipedal bear sighting https://t.co/VEKOj83BVq via @YouTube  why did they have to shoot him?  No weapon... #BlackBearsMatter,819565022.0,20ba6fb3b1ee82da,"Orange, CA",-117.82906,33.81007,ORANGE,2.0,anger,negative
1983,7.90466168540672e+17,2016-10-24,Can't make this ðŸ’© up. Also! We saw a bear today. @ Yosemite National Park https://t.co/6OWWMLgwnb,25641713.0,fbd6d2f5a4e4a15e,"California, USA",-119.5838,37.74491,MARIPOSA,1.0,fear,negative
1984,7.924932688481567e+17,2016-10-29,Ginormous bear attack! @ Costco https://t.co/zhbMQdRfnI,851280638.0,6daef4115502c39e,"Elk Grove, CA",-121.41434,38.46847,SACRAMENTO,1.0,fear,negative
1985,7.932506458054982e+17,2016-11-01,I just saw a bear,440504505.0,3b77caf94bfc81fe,"Los Angeles, CA",-118.36518,33.99941,LOS ANGELES,1.0,fear,neutral
1986,7.941853539176571e+17,2016-11-03,"@IrishErinB Two guys in the woods see a bear. They start running. One guy: ""We can't out run him""! Other guy: ""I only have to outrun YOU!""",143598061.0,3b77caf94bfc81fe,"Los Angeles, CA",-118.36518,33.99941,LOS ANGELES,2.0,fear,neutral
1987,7.9613466639471e+17,2016-11-08,Thanks for making bear attacks go down https://t.co/McvFN1XMOI,4203924853.0,2feb76248fd9c581,"Fullerton, CA",-117.93467,33.90223,ORANGE,2.0,neutral,positive
1988,7.99308876038316e+17,2016-11-17,#TBT to the first time I saw a bear while backpacking! Read the story in my latest blog postâ€¦ https://t.co/ImrYv25iVa,379960128.0,fbd6d2f5a4e4a15e,"California, USA",-119.533165,37.746,MARIPOSA,1.0,fear,neutral
1989,7.992659076755169e+17,2016-11-17,Just woke up from an insanely realistic dream about a bear attack. Night-long drawn out mortal fear left my body sore and full of adrenaline,154844542.0,a592bd6ceb1319f7,"San Diego, CA",-117.10973,32.801037,SAN DIEGO,2.0,fear,negative
1990,7.996932436004086e+17,2016-11-18,Harrowing 14-minute-long 911 call made by Maryland woman during a bear attack: https://t.co/1k6ofRSUnw,26547262.0,f9c0877820b7848a,"Santa Clarita, CA",-118.464645,34.451508,LOS ANGELES,1.0,neutral,neutral
1991,8.00931539416535e+17,2016-11-22,driving up Norumbega with Ashley to see if an animal with attack me and instantly see a bearðŸ˜,1244901228.0,10de09f288b1665c,"Pasadena, CA",-118.1445,34.176346,LOS ANGELES,1.0,fear,neutral
1992,8.019454470319145e+17,2016-11-25,Man this bear attack on leo is gruesome as heck especially in 4k gawwd damn!,2194637371.0,5ecbd073f39c00fa,"Hayward, CA",-122.032455,37.68489,CONTRA COSTA,1.0,disgust,negative
1993,8.033239703133267e+17,2016-11-28,Today has been way sick... Working in the snow and saw a bear,989963540.0,e84d627b345a4032,"Twain Harte, CA",-120.2166,38.06177,TUOLUMNE,1.0,disgust,negative
1994,8.044335772071361e+17,2016-12-01,"No such thing as a bear attack until Mr. Bear walks into your crib, punks you &amp; takes your taco.  If you're in his house, you're just food.",16443518.0,944c03c1d85ef480,"Fresno, CA",-119.76402,36.8023,FRESNO,2.0,neutral,negative
1995,8.055280728374355e+17,2016-12-04,I wanted to see a bear and I found one ðŸ‘€ðŸ‘€ https://t.co/poJPH24pcw,7.301023398355845e+17,526d2258fff0f7ad,"Healdsburg, CA",-122.864685,38.657837,SONOMA,1.0,neutral,positive
1996,8.052193454459617e+17,2016-12-04,@themonkeyguide word to that list. Feel free to check mine out. How to Not get chased by a bear! https://t.co/TvMmJAFfzQ #tedxla,15518172.0,97290292acb29ff8,"Signal Hill, CA",-118.152954,33.8158,LOS ANGELES,2.0,joy,neutral
1997,8.058963154229002e+17,2016-12-05,@SwerskiSports plus he showed he can play in the snow with a wet ball. Haven't seen a bear do convincing pump fake for at least a decade,34098575.0,7d62cffe6f98f349,"San Jose, CA",-121.90978,37.32701,SANTA CLARA,2.0,joy,neutral
1998,8.062815229572956e+17,2016-12-06,Luis said when he comes visit me he better see a bear....wtf lmfao ðŸ˜‚,195481826.0,483f653fcdc595c0,"Merced, CA",-120.4406,37.341507,MERCED,1.0,disgust,neutral
1999,8.157873007601294e+17,2017-01-02,All the celebrity judges fooled by the bear attack stories. Great show!,250248914.0,3b77caf94bfc81fe,"Los Angeles, CA",-118.36518,33.99941,LOS ANGELES,2.0,joy,neutral
2000,8.183066241419918e+17,2017-01-09,I'm going to make a movie about a bear attacking me to express the joy of film. It will be a musical. I'll thank you all in my Oscar speech,19727189.0,59612bd882018c51,"Santa Monica, CA",-118.47271,34.00091,LOS ANGELES,2.0,joy,positive
2001,8.196189235658835e+17,2017-01-12,lrt omg i've never seen a bear fursuit like that.. i want one !,3399785294.0,d563cf7307e4ba95,"Alhambra, CA",-118.14662,34.086224,LOS ANGELES,2.0,surprise,positive
